"","Description","Price","Ratings","Number of Reviews"
"1","Wireless Earbuds Bluetooth Headphones 5.3 Bass Stereo Earphones, 40H Playtime Ear Buds with LED Power Display, Bluetooth Earbud with Noise Cancelling Mic IPX7 Waterproof Earbuds for iOS Android","29.99","4.6 out of 5 stars","3,103"
"2","Wireless Bluetooth Earbuds 120H Playtime Bluetooth 5.3 Ear Buds for Sports, Hi-fi Stereo Earphones with LED Display Charging Case, Headphones for Running/Workout Audifonos Bluetooth inalambricos","59.99","4.4 out of 5 stars","658"
"3","Bluetooth Headphones Wireless Earbuds 80hrs Playtime Wireless Charging Case Digital Display Sports Ear buds with Earhook Waterproof Over-Ear Earphones for TV Phone Laptop Contrast Color (Pearl Gray)","19.99","4.5 out of 5 stars","12,112"
"4","JBL Vibe 200TWS True Wireless Earbuds - Black, Small","32.99","4.2 out of 5 stars","19,681"
"5","A1 Mini Wireless Earbuds Bluetooth 5.3 in Ear Light-Weight Headphones Built-in Microphone, IPX5 Waterproof, Immersive Premium Sound Long Distance Connection Headset with Charging Case, Black","37.99","4.3 out of 5 stars","76,834"
"6","HT2 Hybrid Active Noise Cancelling Headphones, Wireless Over Ear Bluetooth Headphones, 60H Playtime, Hi-Res Audio Custom EQ via App Deep Bass Comfort Fit Ear Cups, for Home Office Travel","58.99","4.6 out of 5 stars","3,514"
"7","Soundcore Anker Life Q20 Hybrid Active Noise Cancelling Headphones, Wireless Over Ear Bluetooth Headphones, 60H Playtime, Hi-Res Audio, Deep Bass, Memory Foam Ear Cups, for Travel, Home Office","15.29","4.5 out of 5 stars","74,453"
"8","Sony WH-1000XM4 Wireless Premium Noise Canceling Overhead Headphones with Mic for Phone-Call and Alexa Voice Control, Black WH1000XM4","29.99","4.6 out of 5 stars","55,107"
"9","JBL Tune 510BT: Wireless On-Ear Headphones with Purebass Sound - Black","49.99","4.6 out of 5 stars","54,174"
"10","JBL Vibe Beam True Wireless Headphones - Black, Small","79.99","4.4 out of 5 stars","6,806"
"11","Bluetooth Headphones Wireless Earbuds 80hrs Playtime Wireless Charging Case Digital Display Sports Ear buds with Earhook Premium Deep Bass IPX7 Waterproof Over-Ear Earphones for TV Phone Laptop Black","49.99","4.5 out of 5 stars","12,112"
"12","BERIBES Bluetooth Headphones Over Ear, 65H Playtime and 6 EQ Music Modes Wireless Headphones with Microphone, HiFi Stereo Foldable Lightweight Headset, Deep Bass for Home Office Cellphone PC Ect.","59.99","4.5 out of 5 stars","22,541"
"13","Ear buds 72Hrs Playback Wireless Earbuds Bluetooth Headphones with LED Digital Display Charging Case Earbuds IPX7 Waterproof Earphones Stereo Sound in-Ear Earbud with Mic for Phone Laptop Sport Black","248.00","4.8 out of 5 stars","491"
"14","Headphones Wireless Earbuds Sport, Bluetooth 5.3 Over Ear Buds Stereo Deep Bass Headset with Earhooks, 48H Wireless Earphones with HD Mic, IP7 Waterproof Earbud for Sports/Running/Workout","348.00","4.8 out of 5 stars","826"
"15","2 Pack Apple Wire Earbuds Headphones with 3.5mm Plug Earphones [Apple MFi Certified] Built-in Microphone & Volume Control Compatible with iPhone/ipad/Android/Computer and Other 3.5mm Jack Devices","39.95","3.9 out of 5 stars","18"
"16","bmani Wireless Earbuds Bluetooth Headphones 48hrs Play Back Sport Earphones with LED Display Over-Ear Buds with Earhooks Built-in Mic Headset for Workout Black","49.95","4.4 out of 5 stars","43,435"
"17","SHOKZ OpenRun (AfterShokz Aeropex) - Open-Ear Bluetooth Bone Conduction Sport Headphones - Sweat Resistant Wireless Earphones for Workouts and Running - Built-in Mic, with Headband","49.95","4.6 out of 5 stars","24,923"
"18","Sony WH-CH720N Noise Canceling Wireless Headphones Bluetooth Over The Ear Headset with Microphone and Alexa Built-in, Black New","37.99","4.5 out of 5 stars","4,312"
"19","Click to see price","58.99","4.5 out of 5 stars","2,249"
"20","Wireless Earbuds Bluetooth V5.3 Headphones 50H Playback Deep Bass Stereo Ear Buds with LED Power Display Charging Case IPX7 Waterproof Earphones with Mic Headset for Laptop Pad Android/iOS Phones","17.99","4.5 out of 5 stars","99,126"
"21","Sony ZX Series Wired On-Ear Headphones, Black MDR-ZX110","19.99","4.4 out of 5 stars","12,748"
"22","Sony WH-1000XM5 The Best Wireless Noise Canceling Headphones with Auto Noise Canceling Optimizer, Crystal Clear Hands-Free Calling, and Alexa Voice Control, Black","19.99","4.5 out of 5 stars","12,818"
"23","Soundcore by Anker P20i True Wireless Earbuds, 10mm Drivers with Big Bass, Bluetooth 5.3, 30H Long Playtime, Water-Resistant, 2 Mics for AI Clear Calls, 22 Preset EQs, Customization via App","49.99","4.3 out of 5 stars","5,296"
"24","Soundcore by Anker Space A40 Auto-Adjustable Active Noise Cancelling Wireless Earbuds, Reduce Noise by Up to 98%, 50H Playtime, Comfortable Fit, Hi-Res Sound, App Customization, Wireless Charge","32.99","3.4 out of 5 stars","1,299"
"25","Soundcore by Anker, Sleep A10 Bluetooth Sleep Earbuds, Noise Blocking Earbuds for Sleep, Comfortable Fit, Bluetooth 5.2, App, for Unlimited Sleep Sounds, Sleep Monitor, Personal Alarm, Side Sleeper","79.99","4.6 out of 5 stars","17,095"
"26","SHOKZ OpenRun Pro - Open-Ear Bluetooth Bone Conduction Sport Headphones - Sweat Resistant Wireless Earphones for Workouts and Running with Premium Deep Base - Built-in Mic, with Hair Band","12.98","4.0 out of 5 stars","2,124"
"27","Bose QuietComfort Ultra Wireless Noise Cancelling Earbuds, Bluetooth Noise Cancelling Earbuds with Spatial Audio and World-Class Noise Cancellation, Black","39.99","4.8 out of 5 stars","3,506"
"28","Wireless Earbuds Bluetooth Headphones, 40H Playtime Stereo IPX5 Waterproof Ear Buds, LED Power Display Cordless in-Ear Earphones with Microphone for iOS Andriod Cell Phone Sports","58.99","4.6 out of 5 stars","1,584"
"29","Bose QuietComfort Wireless Noise Cancelling Headphones, Bluetooth Over Ear Headphones with Up To 24 Hours of Battery Life, Black","129.95","4.2 out of 5 stars","1,256"
"30","Bose QuietComfort Ultra Wireless Noise Cancelling Headphones with Spatial Audio, Over-the-Ear Headphones with Mic, Up to 24 Hours of Battery Life, Black","22.99","4.4 out of 5 stars","262,869"
"31","T6 Wireless Earbuds Bluetooth 5.3 Headphones, Ergonomic Design in-Ear Headset, 50Hrs Playtime with Wireless Charging Case, APP EQ Customisable, IPX8 Waterproof, New Upgraded Version","49.99","5.0 out of 5 stars","5"
"32","USB C Headphones 3 Pack, Type C Earbuds Wired with HD Microphone, in-Ear Earphones Stereo Sound, USB C Earbuds Compatible with iPad, Android Phones, Fits All Type C Devices","328.00","4.3 out of 5 stars","29"
"33","WOINNMM Open Ear Headphones,Bluetooth 5.3 Wireless Earbuds with Mic,LED Display,Immersive Stereo Sound,Clear Calls,30H Playback,Light Weight Running Headphones with Ear-Hook for Workout,Gym,Beige","399.99","4.4 out of 5 stars","1,899"
"34","Wireless Earbuds, 2023 Bluetooth Headphones 5.3 Sport, 50H Ear buds with Earhooks, Dual LED Display Bluetooth Earbuds, Deep Bass Stereo Noise Cancelling Headphones, IP7 Waterproof Running Earphones","19.99",NA,NA
